{
  "heal_id": "AH-R-2026-HEAL-0001",
  "run_id": "R-2026-HEAL-001",
  "suite_id": "SUITE-heal-demo-hc",
  "app": "demo-heal",
  "test_case_id": "TC-HEAL-2",
  "spec": "automation/specs/heal-demo/hc.spec.ts",
  "test_title": "TC-HEAL-2: recupera selector roto con alternativa inequívoca",
  "selector_original": "#search-box",
  "candidates": [
    {
      "selector": "[data-testid=\"search-field\"]",
      "strategy": "stable_attribute",
      "count": 1,
      "unique": true,
      "visible": true,
      "enabled": true,
      "editable": true,
      "role": "textbox",
      "identity": true,
      "reason": "unique match (count=1), state ok, identity verified (role=textbox)",
      "accepted": true
    }
  ],
  "selector_used": "[data-testid=\"search-field\"]",
  "strategy_used": "stable_attribute",
  "reason_accept": "unique strict candidate verified by data-testid and role=textbox",
  "reason_reject": null,
  "mode": "HIGH_CONFIDENCE",
  "used_recovery": true,
  "reused_from_store": false,
  "verification_after": "POST_VERIFICATION_PASS",
  "status": "RECOVERED",
  "action": "fill",
  "expected": { "role": "textbox", "placeholder": "Buscar productos...", "testId": ["search-field", "search-box"] },
  "url": "http://127.0.0.1:4174/heal/demo?v=1",
  "evidence": ["automation/.runs/heal-001/evidence/autoheal/AH-R-2026-HEAL-0001.png"],
  "confidence": "HIGH",
  "duplicate_prevented": false,
  "ai_calls": 0,
  "duration_ms": 321,
  "timestamp": "2026-10-09T10:00:00.000Z"
}