[
  {
    "heal_id": "AH-R-2026-HEAL-0002",
    "run_id": "R-2026-HEAL-002",
    "suite_id": "SUITE-heal-demo-hc",
    "app": "demo-heal",
    "test_case_id": "TC-HEAL-7",
    "spec": "automation/specs/heal-demo/hc.spec.ts",
    "test_title": "TC-HEAL-7: reutiliza alternativa almacenada sin IA",
    "selector_original": "#search-box",
    "candidates": [
      {
        "selector": "[data-testid=\"search-field\"]",
        "strategy": "stored_reuse",
        "count": 1,
        "unique": true,
        "visible": true,
        "enabled": true,
        "editable": true,
        "role": "textbox",
        "identity": true,
        "reason": "unique match (count=1), state ok, identity verified (role=textbox)",
        "accepted": true
      }
    ],
    "selector_used": "[data-testid=\"search-field\"]",
    "strategy_used": "stored_reuse",
    "reason_accept": "stored alternative re-validated and still matches the expected element",
    "reason_reject": null,
    "mode": "HIGH_CONFIDENCE",
    "used_recovery": true,
    "reused_from_store": true,
    "verification_after": "POST_VERIFICATION_PASS",
    "status": "REUSED",
    "action": "fill",
    "expected": { "role": "textbox", "placeholder": "Buscar productos...", "testId": ["search-field", "search-box"] },
    "url": "http://127.0.0.1:4174/heal/demo?v=1",
    "evidence": ["automation/.runs/heal-002/evidence/autoheal/AH-R-2026-HEAL-0002.png"],
    "confidence": "HIGH",
    "duplicate_prevented": false,
    "ai_calls": 0,
    "duration_ms": 210,
    "timestamp": "2026-10-09T10:05:00.000Z"
  },
  {
    "heal_id": "AH-R-2026-HEAL-0003",
    "run_id": "R-2026-HEAL-002",
    "suite_id": "SUITE-heal-demo-off",
    "app": "demo-heal",
    "test_case_id": "TC-HEAL-9",
    "spec": "automation/specs/heal-demo/off.spec.ts",
    "test_title": "TC-HEAL-9: modo OFF no intenta recuperar",
    "selector_original": "#search-box",
    "candidates": [],
    "selector_used": null,
    "strategy_used": null,
    "reason_accept": null,
    "reason_reject": "Auto-healing is OFF: no recovery attempted; original selector left unchanged",
    "mode": "OFF",
    "used_recovery": false,
    "reused_from_store": false,
    "verification_after": "NOT_PERFORMED",
    "status": "NOT_ATTEMPTED",
    "action": "read",
    "expected": { "role": "textbox", "placeholder": "Buscar productos..." },
    "url": "http://127.0.0.1:4174/heal/demo?v=1",
    "evidence": [],
    "confidence": "HIGH",
    "duplicate_prevented": false,
    "ai_calls": 0,
    "duration_ms": 12,
    "timestamp": "2026-10-09T10:06:00.000Z"
  }
]